{
  "$schema": "https://json-schema.org/draft/2020-12/schema",
  "$id": "openmontage/artifacts/storyboard",
  "title": "Storyboard",
  "description": "Reviewable beat timeline produced before asset generation. Each beat carries its own duration, on-screen label, optional voiceover line, timestamped SFX cues, and music-duck points. The human approves this beat timeline BEFORE the assets stage spends on generation or render.",
  "type": "object",
  "required": ["version", "total_seconds", "beats"],
  "properties": {
    "version": { "type": "string", "const": "1.0" },
    "total_seconds": {
      "type": "number",
      "minimum": 0,
      "description": "Total runtime of the storyboard in seconds."
    },
    "music_bed": {
      "type": "string",
      "description": "Path or asset-manifest ID of the background music bed for the whole timeline."
    },
    "beats": {
      "type": "array",
      "minItems": 1,
      "items": {
        "type": "object",
        "required": ["id", "start_seconds", "duration_seconds", "on_screen"],
        "properties": {
          "id": { "type": "string" },
          "start_seconds": { "type": "number", "minimum": 0 },
          "duration_seconds": { "type": "number", "minimum": 0 },
          "on_screen": {
            "type": "string",
            "description": "Short label describing what is visible on screen during this beat."
          },
          "vo": {
            "type": "string",
            "description": "Voiceover / narration line spoken during this beat."
          },
          "sfx": {
            "type": "array",
            "description": "Sound-effect cues placed at timestamps relative to the start of this beat.",
            "items": {
              "type": "object",
              "required": ["at_seconds", "cue"],
              "properties": {
                "at_seconds": { "type": "number", "minimum": 0 },
                "cue": { "type": "string", "description": "SFX name or description." }
              },
              "additionalProperties": false
            }
          },
          "music": {
            "type": "array",
            "description": "Music-duck points placed at timestamps relative to the start of this beat.",
            "items": {
              "type": "object",
              "required": ["at_seconds", "level_db", "reason"],
              "properties": {
                "at_seconds": { "type": "number", "minimum": 0 },
                "level_db": {
                  "type": "number",
                  "description": "Target music-bed level in dB at this point (negative = ducked below nominal)."
                },
                "reason": { "type": "string", "description": "Why the music ducks here (e.g. VO onset, SFX hit)." }
              },
              "additionalProperties": false
            }
          }
        },
        "additionalProperties": false
      }
    },
    "metadata": { "type": "object" }
  },
  "additionalProperties": false
}
